{"$schema":"https://json-schema.org/draft/2020-12/schema","$id":"selection-manifest.schema.json","title":"selection-manifest","type":"object","additionalProperties":false,"required":["schema_version","selection_policy_version","naming_policy_version","input_hashes","input_fingerprints","decisions","reviews","operations","offline","network_requests","api_calls","published","imported","fingerprint"],"properties":{"schema_version":{"const":"1.0.0"},"selection_policy_version":{"const":"selection-v1"},"naming_policy_version":{"const":"catalog-layout-v1"},"input_hashes":{"type":"object"},"input_fingerprints":{"type":"object"},"decisions":{"type":"array"},"reviews":{"type":"array"},"operations":{"type":"array"},"offline":{"const":true},"network_requests":{"const":0},"api_calls":{"const":0},"published":{"const":false},"imported":{"const":false},"fingerprint":{"type":"string","pattern":"^[0-9a-f]{64}$"}}}
