{"schema_version":"1.0.0","selection_policy_version":"selection-v1","naming_policy_version":"catalog-layout-v1","input_hashes":{},"input_fingerprints":{},"decisions":[],"reviews":[],"operations":[],"offline":true,"network_requests":0,"api_calls":0,"published":false,"imported":false,"fingerprint":"aaaaaaaaaaaaaaaaaaaaaaaaaaaaaaaaaaaaaaaaaaaaaaaaaaaaaaaaaaaaaaaa"}
